### ISSUE TITLE
code: -32603, message: Remote node did not answer to eth_feeHistory correctly

### ISSUE THREAD

**Issue by aathan** [foundry-rs/foundry#3403]
### Component

Forge

### Have you ensured that all of these are up to date?

- [X] Foundry
- [X] Foundryup

### What version of Foundry are you on?

forge 0.2.0 (98fa895 2022-09-28T00:08:23.30706613Z)

### What command(s) is the bug in?

forge script ... --broadcast

### Operating System

Linux

### Describe the bug

EDIT: I've determined the primary error reported is not due to a formatting bug per-se, but forge's behavior may be problematic (see latest comments) because (1) it makes the eth_feeHistory request twice, formatting the parameters differently and (2) it does not report the second error, which is from a second attempt at the call, with apparently incorrectly formatted params. This possibly looks like there may be some fallback attempt by forge, to send the request using a different formatting scheme, because the first request failed???

ORIGINAL REPORT:
There appears to still be a bug (possibly related to the whole QUANTITY vs LOCATION parameter formatting thing at #1297?) attempting to deploy vs a hardhat instance. I assume that broadcasting via forge, to a hardhat node, should result in blockchain state that can be queried via cast after the deployment right? I'm not sure if the error results in the broadcast to be reverted or if the contract deployment never in fact happened...

... happy to provide further output if you give me guidance.

```
$ npx hardhat --version
2.11.2
```

```
$ forge script script/Contract.s.sol:ContractScript --rpc-url http://0.0.0.0:8545/ --broadcast --verify -vvvv --etherscan-api-key 0
[⠢] Compiling...
No files changed, compilation skipped
Traces:
  [3347138] ContractScript::run() 
...
    ├─ [657385] → new XyzProxy@0x4c5859f0F772848b2D91F1D83E2Fe57935348029
...

Script ran successfully.
==========================
Simulated On-chain Traces:
...

Error: 
(code: -32603, message: Remote node did not answer to eth_feeHistory correctly, data: Some(Object({"message": String("Remote node did not answer to eth_feeHistory correctly")})))


$ cast call 0x4c5859f0F772848b2D91F1D83E2Fe57935348029 'totalSupply()(uint256)' --rpc-url http://0.0.0.0:8545/
Error: 
Contract 0x4c5859f0f772848b2d91f1d83e2fe57935348029 does not exist
```

**Comment by aathan** [comment]
The below conversation captured by tcpdump is from issuing: `forge script script/Contract.s.sol:ContractScript --rpc-url http://0.0.0.0:8545/ --broadcast`

It looks pretty strange to me because it looks like the eth_feeHistory call is attempted twice, with the parameter formatting changed during the second attempt ...

```
... prior POST of deployment transaction removed...

POST / HTTP/1.1
content-type: application/json
accept: */*
host: 0.0.0.0:8545
content-length: 82

{"id":3,"jsonrpc":"2.0","method":"eth_feeHistory","params":["0xa","latest",[5.0]]}
19:45:59.009489 IP localhost.8545 > localhost.43066: Flags [.], ack 524, win 512, options [nop,nop,TS val 3884167419 ecr 3884167375], length 0
E..4..@.@.A.........!a.:4*.O.........(.....
........
19:45:59.120697 IP localhost.8545 > localhost.43066: Flags [P.], seq 3006:3496, ack 524, win 512, options [nop,nop,TS val 3884167530 ecr 3884167375], length 490
E.....@.@.?.........!a.:4*.O...............
...j....HTTP/1.1 200 OK
Access-Control-Allow-Origin: *
Access-Control-Request-Method: *
Access-Control-Allow-Methods: OPTIONS, GET
Access-Control-Allow-Headers: *
Content-Type: application/json
Date: Wed, 28 Sep 2022 19:45:59 GMT
Connection: keep-alive
Keep-Alive: timeout=5
Content-Length: 191

{"jsonrpc":"2.0","id":3,"error":{"code":-32603,"message":"Remote node did not answer to eth_feeHistory correctly","data":{"message":"Remote node did not answer to eth_feeHistory correctly"}}}
19:45:59.120974 IP localhost.43066 > localhost.8545: Flags [P.], seq 524:707, ack 3496, win 512, options [nop,nop,TS val 3884167530 ecr 3884167530], length 183
E.....@.@..Z.........:!a....4*.9...........
...j...jPOST / HTTP/1.1
content-type: application/json
accept: */*
host: 0.0.0.0:8545
content-length: 79

{"id":4,"jsonrpc":"2.0","method":"eth_feeHistory","params":[10,"latest",[5.0]]}
19:45:59.120990 IP localhost.8545 > localhost.43066: Flags [.], ack 707, win 511, options [nop,nop,TS val 3884167530 ecr 3884167530], length 0
E..4..@.@.A.........!a.:4*.9.........(.....
...j...j
19:45:59.122935 IP localhost.8545 > localhost.43066: Flags [P.], seq 3496:4018, ack 707, win 512, options [nop,nop,TS val 3884167532 ecr 3884167530], length 522
E..>..@.@.?.........!a.:4*.9.........3.....
...l...jHTTP/1.1 200 OK
Access-Control-Allow-Origin: *
Access-Control-Request-Method: *
Access-Control-Allow-Methods: OPTIONS, GET
Access-Control-Allow-Headers: *
Content-Type: application/json
Date: Wed, 28 Sep 2022 19:45:59 GMT
Connection: keep-alive
Keep-Alive: timeout=5
Content-Length: 223

{"jsonrpc":"2.0","id":4,"error":{"code":-32602,"message":"Errors encountered in param 0: Invalid value 10 supplied to : QUANTITY","data":{"message":"Errors encountered in param 0: Invalid value 10 supplied to : QUANTITY"}}}
```

**Comment by aathan** [comment]
Upon further investigation it appears hardhat is reaching out to the configured:
```
    hardhat: {
      chainId: 43114,
      gasPrice: 225000000000,
      forking: {
        url: "https://api.avax.network/ext/bc/C/rpc",
        enabled: true,
        //blockNumber: 99999...
         ...
```

upstream RPC provider, and this problem was due to the (now commented) blockNumber: directive. I guess the upstream RPC provider did not want to answer queries from that far back?

I'm leaving this issue open due to the existence of two separate calls to eth_feeHistory (per above trace), each with different formatting, and the -32602 (second error) not having been reported by forge. Possibly this is expected behavior.

**Comment by mds1** [comment]
Duplicate calls to `eth_feeHistory` seems expected so the script can fetch the latest data before each broadcast. And I vaguely remember that hardhat quantity but I think it should be fixed now? Going to close this, but we can reopen if there is still an issue here
